{
  "adapter_id": "demo-grant-portal",
  "adapter_version": 1,
  "captured_at": "2026-08-08T12:20:00+03:00",
  "revision": "grant-rev-003",
  "values": {
    "general.identity.title": {
      "present": true,
      "value": "Molecular iron complexes"
    },
    "general.identity.competition": {
      "present": true,
      "value": "Fundamental research 2026"
    },
    "description.summary.text": {
      "present": true,
      "value": "Summary rewritten locally."
    },
    "description.relevance.text": {
      "present": true,
      "value": "Relevance edited by the user on the website."
    },
    "budget.totals.total": {
      "present": true,
      "value": 1200000
    }
  },
  "metadata": {
    "source_url": "https://grant.example.invalid/application/42"
  }
}
